| id | title                             | genres                                      | overview                                                                                                    |
| -- | --------------------------------- | ------------------------------------------- | ----------------------------------------------------------------------------------------------------------- |
| 1  | Toy Story                         | Adventure Animation Children Comedy Fantasy | A cowboy doll is profoundly threatened and jealous when a new spaceman figure supplants him as top toy.     |
| 2  | Jumanji                           | Adventure Children Fantasy                  | When two kids find and play a magical board game, they release a man trapped in it for decades.             |
| 3  | Grumpier Old Men                  | Comedy Romance                              | A romantic comedy about finding love later in life, despite grumpy exteriors.                               |
| 4  | Waiting to Exhale                 | Comedy Drama Romance                        | Women bond over life, love, and heartbreak in this emotional story.                                         |
| 5  | Father of the Bride Part II       | Comedy                                      | The story of a father coming to terms with his daughter’s growing family.                                   |
| 6  | Heat                              | Action Crime Drama                          | A group of professional bank robbers start to feel the heat from police when they unknowingly leave a clue. |
| 7  | Saving Private Ryan               | Drama War                                   | A WWII squad goes behind enemy lines to retrieve a paratrooper whose brothers have been killed in action.   |
| 8  | The Dark Knight                   | Action Crime Drama                          | Batman faces his nemesis, the Joker, who plunges Gotham into chaos.                                         |
| 9  | Forrest Gump                      | Drama Romance                               | A slow-witted but kind man witnesses and influences key historical events.                                  |
| 10 | Inception                         | Action Adventure Sci-Fi                     | A thief who enters dreams must plant an idea into a target's mind.                                          |
| 11 | The Matrix                        | Action Sci-Fi                               | A hacker discovers reality is a simulated world controlled by machines.                                     |
| 12 | Gladiator                         | Action Adventure Drama                      | A former Roman general seeks revenge against a corrupt emperor.                                             |
| 13 | The Shawshank Redemption          | Drama Crime                                 | Two imprisoned men bond over years, finding solace and eventual redemption.                                 |
| 14 | Pulp Fiction                      | Crime Drama                                 | Interwoven stories of criminals in Los Angeles.                                                             |
| 15 | The Lion King                     | Animation Adventure Drama                   | A lion prince flees exile only to reclaim his kingdom.                                                      |
| 16 | Interstellar                      | Adventure Drama Sci-Fi                      | A team of explorers travel through a wormhole to save humanity.                                             |
| 17 | Back to the Future                | Adventure Comedy Sci-Fi                     | A teenager travels back in time and risks changing his own future.                                          |
| 18 | Titanic                           | Drama Romance                               | A romance unfolds aboard the ill-fated RMS Titanic.                                                         |
| 19 | The Avengers                      | Action Adventure Sci-Fi                     | Earth’s mightiest heroes unite to stop an alien invasion.                                                   |
| 20 | Jurassic Park                     | Adventure Sci-Fi                            | A theme park suffers disaster when cloned dinosaurs escape.                                                 |
| 21 | Star Wars: Episode IV             | Action Adventure Fantasy                    | A young farm boy joins a rebellion against an evil empire.                                                  |
| 22 | The Godfather                     | Crime Drama                                 | The aging patriarch of an organized crime dynasty transfers control to his son.                             |
| 23 | The Silence of the Lambs          | Crime Drama Thriller                        | A young FBI cadet seeks help from an imprisoned cannibal to catch a serial killer.                          |
| 24 | Fight Club                        | Drama                                       | An insomniac office worker forms an underground fight club.                                                 |
| 25 | The Green Mile                    | Crime Drama Fantasy                         | Death row guards witness supernatural events surrounding an inmate.                                         |
| 26 | The Prestige                      | Drama Mystery Sci-Fi                        | Rival magicians engage in a competitive battle with dangerous consequences.                                 |
| 27 | The Departed                      | Crime Drama Thriller                        | An undercover cop and a mole try to identify each other.                                                    |
| 28 | Mad Max: Fury Road                | Action Adventure Sci-Fi                     | In a post-apocalyptic wasteland, rebels fight a tyrant.                                                     |
| 29 | The Social Network                | Biography Drama                             | The story of Facebook’s founding and rise.                                                                  |
| 30 | Whiplash                          | Drama Music                                 | A young drummer faces abuse from his demanding teacher.                                                     |
| 31 | Django Unchained                  | Drama Western                               | A freed slave sets out to rescue his wife from a brutal plantation owner.                                   |
| 32 | La La Land                        | Comedy Drama Music                          | Two aspiring artists fall in love in Los Angeles.                                                           |
| 33 | The Wolf of Wall Street           | Biography Crime Drama                       | The rise and fall of a stockbroker involved in crime and corruption.                                        |
| 34 | Spider-Man: Into the Spider-Verse | Animation Action Adventure                  | A teenager becomes Spider-Man and meets alternate versions from other dimensions.                           |
| 35 | The Incredibles                   | Animation Action Adventure                  | A family of superheroes balances saving the world and family life.                                          |
| 36 | The Lion King II: Simba's Pride   | Animation Adventure Drama                   | The daughter of Simba faces a new challenge to the Pride Lands.                                             |
| 37 | Inside Out                        | Animation Adventure Comedy                  | Personified emotions try to guide a girl through a difficult move.                                          |
| 38 | Finding Nemo                      | Animation Adventure Comedy                  | A clownfish searches for his lost son.                                                                      |
| 39 | Up                                | Animation Adventure Comedy                  | An old man ties balloons to his house to fulfill a lifelong dream.                                          |
| 40 | Braveheart                        | Biography Drama History                     | Scottish warrior leads a revolt against English rule.                                                       |
| 41 | The Big Lebowski                  | Comedy Crime                                | A slacker becomes embroiled in a kidnapping case.                                                           |
| 42 | Guardians of the Galaxy           | Action Adventure Comedy                     | A group of intergalactic criminals must work together to save the galaxy.                                   |
| 43 | Black Panther                     | Action Adventure Sci-Fi                     | The king of Wakanda fights to protect his people and the world.                                             |
| 44 | Deadpool                          | Action Adventure Comedy                     | A wisecracking mercenary gains accelerated healing powers.                                                  |
| 45 | John Wick                         | Action Crime Thriller                       | An ex-hitman comes out of retirement to seek vengeance.                                                     |
| 46 | The Martian                       | Adventure Drama Sci-Fi                      | An astronaut struggles to survive on Mars after being left behind.                                          |
| 47 | Glory                             | Drama History War                           | A regiment of African-American soldiers fights in the Civil War.                                            |
| 48 | Slumdog Millionaire               | Drama Romance                               | An Indian teenager reflects on his life after winning a quiz show.                                          |
| 49 | No Country for Old Men            | Crime Drama Thriller                        | A hunter finds a fortune that puts him in the path of a relentless killer.                                  |
| 50 | The Grand Budapest Hotel          | Adventure Comedy Crime                      | A legendary concierge tries to protect a priceless painting.                                                |
